{
  "id": "1d2e3f4a-5b6c-4d7e-8f9a-0b1c2d3e4f5a",
  "model_id": "model.anthropic.claude-sonnet-5",
  "version": "1.0.0",
  "description": "Anthropic Claude Sonnet 5 — primary reasoning/generation model for Lead Intelligence and Conversation agents requiring balanced cost and quality.",
  "state": "active",
  "provider": "anthropic",
  "model_name": "claude-sonnet-5-20260115",
  "capabilities": ["text_generation", "function_calling", "reasoning", "structured_output"],
  "reasoning_level": "medium",
  "context_window": {
    "max_input_tokens": 200000,
    "max_output_tokens": 8192
  },
  "cost": {
    "unit": "per_token",
    "input_cost": 0.000003,
    "output_cost": 0.000015,
    "currency": "USD"
  },
  "latency": {
    "p50_ms": 900,
    "p95_ms": 2500
  },
  "availability": {
    "sla_percent": 99.9,
    "regions": ["us-east-1", "ap-southeast-1"]
  },
  "fallback": ["model.anthropic.claude-haiku-5", "model.openai.gpt-5-mini"],
  "priority": 9,
  "routing_policy": {
    "tier": "standard",
    "task_type_mapping_ref": "registry.model_registry.task_tier_mapping.v1"
  },
  "tenant_scope": "tenant_override_allowed",
  "owner": "ai-platform-team",
  "tags": ["primary", "reasoning", "conversation"],
  "metadata": {
    "created_by": "system"
  }
}
